ffff88e3cc6e1540 2370705226 S Ci:3:009:0 s 80 08 0000 0000 0001 1 <
ffff88e3cc6e1540 2370709803 C Ci:3:009:0 0 1 = 01
ffff88e3cc6e1540 2370709910 S Ci:3:009:0 s a1 00 0000 0100 0402 1026 <
ffff88e3cc6e1540 2370715896 C Ci:3:009:0 0 75 = 004b4d46 473a4b4f 4e494341 204d494e 4f4c5441 3b434d44 3a474449 2c585053
ffff88e3cc6e1540 2370715955 S Ci:3:009:0 s 80 06 0300 0000 0004 4 <
ffff88e3cc6e1540 2370720193 C Ci:3:009:0 0 4 = 04030904
ffff88e3cc6e1540 2370720270 S Ci:3:009:0 s 80 06 0301 0409 00ff 255 <
ffff88e3cc6e1540 2370724294 C Ci:3:009:0 0 30 = 1e034b00 4f004e00 49004300 41002000 4d004900 4e004f00 4c005400 4100
ffff88e3cc6e1540 2370724360 S Ci:3:009:0 s 80 06 0300 0000 0004 4 <
ffff88e3cc6e1540 2370728417 C Ci:3:009:0 0 4 = 04030904
ffff88e3cc6e1540 2370728451 S Ci:3:009:0 s 80 06 0302 0409 00ff 255 <
ffff88e3cc6e1540 2370732542 C Ci:3:009:0 0 38 = 26034b00 4f004e00 49004300 41002000 4d004900 4e004f00 4c005400 41002000
ffff88e3cc6e1540 2370732601 S Ci:3:009:0 s 80 06 0300 0000 0004 4 <
ffff88e3cc6e1540 2370736527 C Ci:3:009:0 0 4 = 04030904
ffff88e3cc6e1540 2370736636 S Ci:3:009:0 s 80 06 0303 0409 00ff 255 <
ffff88e3cc6e1540 2370740648 C Ci:3:009:0 0 28 = 1c034100 38004100 36003000 34003100 30003200 39003400 32003300
ffff88e3cc6e1780 2371467251 S Bo:3:009:1 -115 0
ffff88e3cc6e1780 2371468402 C Bo:3:009:1 0 0
ffff88e3cc6e1780 2371468461 S Bo:3:009:1 -115 10445 = 1b252d31 32333435 5840504a 4c0d0a40 504a4c20 53455420 434f4d50 52455353
ffff88e3cc6e1780 2371473029 C Bo:3:009:1 0 10445 >
ffff88e3cc6e1780 2371473104 S Bo:3:009:1 -115 46 = 40504a4c 20534554 20504147 45535441 5455533d 454e440d 0a40504a 4c20454f
ffff88e3cc6e1780 2371483283 C Bo:3:009:1 0 46 >
